[
  {
    "id": 100,
    "started_at": "2025-09-08 15:15:44",
    "ended_at": null,
    "status": "In progress",
    "comment": null,
    "order_id": 100,
    "user_id": 2,
    "location_id": 37
  },
  {
    "id": 101,
    "started_at": "2025-09-08 15:15:51",
    "ended_at": null,
    "status": "In progress",
    "comment": null,
    "order_id": 101,
    "user_id": 2,
    "location_id": 37
  }
]